id,content,visible
2947,"Assets of $%a have been validated using asset account information. The asset report is acceptable documentation to support these assets.  If the actual amount of funds required to close is greater than the Funds Required to Close specified in DU, document sufficient liquid assets to cover the additional amount.",True
2949,"Assets of $%a have been validated using asset account information. Receipt of funds realized from the sale or liquidation of a stock, mutual fund or retirement account in the amount of $%a must be documented.  If the actual amount of funds required to close is greater than the Funds Required to Close specified in DU, document sufficient liquid assets to cover the additional amount.",True
2951,"Assets of $%a have been calculated using asset account information, which is lower than amount of funds DU required to be verified. Verify the accounts needed to satisfy the amount of funds required to be verified by DU.",True
2953,A large deposit of $%a has been identified on the %a account of %a using asset account information. This amount has been included in the total amount of assets validated.  Document that these funds are from an acceptable source.  Refer to the Fannie Mae Selling Guide for additional information.,True
2955,"If the retirement account allows for withdrawals only in connection with the borrower's employment termination, retirement, or death; or the account does not allow for any type of withdrawal, the retirement asset should not be entered.",True
2975,Self-employment income for %a of $%a entered on the online loan application has been validated using tax return data.  The tax return data is acceptable documentation to support this income.,True
2977,"Self-employment income for %a of $%a has been calculated using tax return data, which is lower than the self-employment income entered on the online loan application for the borrower.  The self-employed income must be supported by personal tax returns covering the most recent year, with all schedules.",True
2979,"Self-employment income for %a of $%a has been calculated using tax return data, which is lower than the self-employment income entered on the online loan application for the borrower.  The self-employed income may be supported by personal and business tax returns covering the most recent one-year period (including all tax schedules), provided the tax returns reflect at least 12 months of self-employment income and the Cash Flow Analysis (Form 1084) or equivalent has been completed.  Otherwise, lenders must obtain personal and business tax returns covering the most recent two-year period (including all tax schedules), though the requirement for business tax returns can be waived if personal returns covering the most recent two-year period are obtained, and (1) the borrower has been self-employed in the same business for at least five years, (2) the borrower's individual tax returns show an increase in self-employment income over the last two years, and (3) the borrower is paying the down payment and closing costs with his or her own funds, and is not using any funds from the business account to fund the transaction or satisfy applicable reserve requirements.  Refer to the Selling Guide for additional information.",True
2981,"Self-employment income for %a of $%a has been calculated using tax return data, which is lower than the self-employment income entered on the online loan application for the borrower.  The self-employed income must be supported by business and personal tax returns covering the most recent two-year period, including all tax schedules, if it will be used for qualifying purposes.  The requirement for business tax returns can be waived if (1) the borrower has been self-employed in the same business for at least five years, (2) the borrower's individual tax returns show an increase in self-employment income over the last two years, and (3) the borrower is paying the down payment and closing costs with his or her own funds, and is not using any funds from the business account to fund the transaction or satisfy applicable reserve requirements.  For guidance on borrowers that have been self-employed less than two years, or for any additional information on the verification of self-employment income, refer to the Selling Guide.",True
2983,"The information obtained from tax return data associated to Reference Number %a for %a did not contain either a correct tax form, or sufficient years of tax forms, to validate one or more income types.",True
2985,"The following businesses provided on the online loan application were matched to a corresponding business in the tax return data. Only income from these businesses was used by DU to validate the self-employment income entered on the online loan application.
Borrower|Business Name from DU",True
2987,"Based on information obtained from tax return data, %a appears to own multiple businesses.  Because tax return data was not obtained for all businesses, self-employment income for the borrower will not be validated.",True
2997,"Tax return information received for the borrower(s) from the vendor(s) shown below using the associated Reference Number(s) did not contain the most recent tax filing.
Borrower|Vendor|Reference #|Report Date",True
2999,"Tax return information on %a's income was not received from Equifax.  Either information was not ordered from Equifax by the lender, Equifax did not have information on the borrower when the lender placed the order, or the Lender Loan Number and borrower Social Security Number entered on the online loan application do not match those provided to Equifax.",True
3001,"Tax return information was received for the borrower(s) from the vendor(s) shown below using the associated Reference Number(s).  This tax return information may include tax return data for another borrower on the loan casefile if the tax returns were filed jointly.  Although the other borrower may not be reflected in the list below, the tax return data may be used to validate his or her income.  Refer to the report(s) as provided by vendor(s). Based on this report, the loan must close on or before the earliest date provided.  
Borrower|Vendor|Reference #|Report Date|Close By Date",True
3003,This loan casefile may have gone through the DU validation service.  Any vendor reports need to be retained in the loan file. The lender remains responsible for investigating any contradictory information in the loan file.,False
3005,"The loan casefile is ineligible for delivery to Fannie Mae.  Based on the number of financed properties derived from the loan application or credit report, the borrower will be obligated on more than 10 financed properties.",True
3007,"This loan casefile is ineligible for delivery to Fannie Mae.  Based on the number of financed properties derived from the loan application or credit report, the borrower will be obligated on 7-10 financed properties, and the representative credit score is less than 720.",True
3009,"The number of financed properties used in determining the loan's eligibility and minimum reserve requirements was %a.  This information was provided in the Number of Financed Properties field.  If this information is incorrect, the number must be updated and the loan casefile resubmitted to DU.",False
3011,"The number of financed properties used in determining the loan's eligibility and minimum reserve requirements was %a.  This information was derived based on the properties listed in the Real Estate Owned section of the loan application.  If this information is incorrect the correct number must be provided in the Number of Financed Properties field, or the Real Estate Owned section must be updated and the loan casefile resubmitted to DU.",False
3013,"The number of financed properties used in determining the loan's eligibility for sale to Fannie Mae and minimum reserve requirements was %a.  This information was derived based on the number of mortgages listed on the loan application or credit report.  If this information is incorrect, provide the correct number in the Number of Financed Properties field, or complete the Real Estate Owned section of the loan application and resubmit the loan casefile to DU.",False
3015,"The number of financed properties used in determining the loan's eligibility for sale to Fannie Mae and minimum reserve requirements was based on the properties listed in the Real Estate Owned section.  However, it appears that there are at least twice the number of mortgages on the loan application or credit report when compared to the number of properties in the Real Estate Owned section of the application.  Confirm that all properties in the Real Estate Owned section are appropriately disclosed, and if changes to the loan application are needed, update the information and resubmit the loan casefile to DU.",False
3017,"The number of financed properties used in determining the loan's eligibility for sale to Fannie Mae and minimum reserve requirements was based on the number of mortgages or HELOCs listed on the loan application.  However, it appears that the credit report includes more mortgages and/or HELOCs than the loan application.  Confirm that all open mortgages and HELOCs are appropriately disclosed, and if changes to the loan application are needed, update the information and resubmit the loan casefile to DU.",False
3019,"This loan casefile is ineligible for sale to Fannie Mae as it does not meet the minimum amount of reserves required for the subject of the second home or investment property transaction of %a, and/or the minimum amount of reserves required for any other financed properties of %a. Refer to the Selling Guide for additional information.",True
3021,"Verify at least two nontraditional credit sources for each borrower that does not have traditional credit, one of which must be housing-related. A 12-month payment history is required for each source of nontraditional credit, which must be documented and assessed in accordance with the requirements specified in the Selling Guide.",True
3023,This loan casefile is eligible for delivery as a HomeReady mortgage loan.,True
3031,"Credit for %a: Historically, mortgages for borrowers with no installment tradelines have experienced an increased incidence of mortgage delinquencies.",True
3033,"Credit for %a: Historically, mortgages for borrowers with inactive installment credit activity have experienced a higher incidence of mortgage delinquencies than borrowers with recent installment activity.",True
3035,Credit for %a: Research has shown that borrowers with a minimal reduction in the balance of installment loans from the original loan amounts represent a higher risk of mortgage delinquencies.,True
3037,"Credit for %a: Historically, mortgages for borrowers with limited experience paying a significant installment debt have experienced an increased incidence of mortgage delinquencies.",True
3039,Credit for %a: The credit report indicates there are late payments on accounts. Research has shown that borrowers with late payments represent a higher risk of mortgage delinquency.,True
3041,"Desktop Underwriter has identified a preforeclosure sale that was reported within the last four years.  The lender must document that the event was completed four or more years from the disbursement date of the new loan in order for the loan to be eligible for delivery to Fannie Mae.  A two-year waiting period is permitted if extenuating circumstances can be confirmed with an explanation from the borrower and documents to either confirm the event, or illustrate factors that lead to the event as specified in the Selling Guide.
Borrower|Creditor|Account Number",True
3043,"The credit report has identified a preforeclosure sale but the information is incomplete. The lender must document that the event was completed four or more years from the disbursement date of the new loan in order for the loan to be eligible for delivery to Fannie Mae.  A two-year waiting period is permitted if extenuating circumstances can be confirmed with an explanation from the borrower and documents to either confirm the event, or illustrate factors that lead to the event as specified in the Selling Guide.
Borrower  | Creditor | Account Number",True
3045,"Desktop Underwriter has identified the following mortgage charge-off on the credit report. All mortgage charge-offs must have been completed four or more years from the disbursement date of the new loan. A two-year waiting period is permitted if extenuating circumstances can be confirmed with an explanation from the borrower and documents to either confirm the event, or illustrate factors that lead to the event as specified in the Selling Guide. 
Borrower | Creditor | Account Number",True
3047,"The credit report has identified a mortgage charge-off but the information is incomplete.  The lender must document that the event was completed four or more years from the disbursement date of the new loan in order for the loan to be eligible for delivery to Fannie Mae.  A two-year waiting period is permitted if extenuating circumstances can be confirmed with an explanation from the borrower and documents to either confirm the event, or illustrate factors that lead to the event as specified in the Selling Guide.
Borrower  | Creditor | Account Number",True
3049,"Desktop Underwriter has identified the following deed-in-lieu of foreclosure that was reported within the last four years.  The lender must document that the event was completed four or more years from the disbursement date of the new loan in order for the loan to be eligible for delivery to Fannie Mae.  A two-year waiting period is permitted if extenuating circumstances can be confirmed with an explanation from the borrower and documents to either confirm the event, or illustrate factors that lead to the event as specified in the Selling Guide.
Borrower  | Creditor | Account Number",True
3051,"The credit report has identified a deed-in-lieu of foreclosure but the information is incomplete. The lender must document that the event was completed four or more years from the disbursement date of the new loan in order for the loan to be eligible for delivery to Fannie Mae.  A two-year waiting period is permitted if extenuating circumstances can be confirmed with an explanation from the borrower and documents to either confirm the event, or illustrate factors that lead to the event as specified in the Selling Guide.  
Borrower | Creditor | Account Number",True
3055,"An income type has been entered on the loan application, but DU is unable to determine the specific type of income. All income included on the loan application must be eligible and documented according to the requirements of the Selling Guide.",True
3057,"Based on the seller paid closing costs and seller credits entered, the total amount of interested party contributions appears to exceed the total of the estimated closing costs, discount points and prepaids.  In order for the loan to be eligible for delivery, the lender must ensure that all interested party contribution requirements outlined in the Selling Guide have been met.  This may include adjustments to the LTV/CLTV to reflect the interested party contribution amount that exceeds the closing costs, discount points and prepaids.  This adjustment may cause the loan to exceed the maximum allowed LTV or CLTV, requiring the loan amount to also be reduced.",True
3059,"Based on the data entered, the total amount of lender credits appears to exceed the total of the estimated closing costs, discount points and prepaids.  The lender must review the transaction as lender credits may not be used as a source of funds to satisfy down payment requirements.",True
3061,"Based on the Homebuyer Education Completion Indicator at least one borrower on the loan has completed housing counseling prior to signing the sales contract.  Documentation of the completion of the housing counseling must be provided on Fannie Mae Form 1017.  If this indicator is incorrect, the data must be corrected and the loan casefile resubmitted to DU.",True
3063,DU's ability to contact the Collateral Underwriter (CU) service has been disabled due to technical issues with the CU service.  Resubmit at a later time in order to receive a complete set of CU messages.,True
3065,The Collateral Underwriter message service has encountered an unexpected error. Please resubmit at a later time for a complete set of collateral messages.,True
3067,The Collateral Underwriter message service is temporarily unavailable. Please resubmit at a later time for a complete set of collateral messages.,True
3071,Verification of Employment and/or Income (VOE/VOI) information on %a was not received from %a.  Either information was not ordered from %a by the lender or the Reference Number and borrower Social Security Number entered on the online loan application do not match those provided by %a.,False
3073,Tax return information on %a's income was not received from %a.  Either information was not ordered from %a by the lender or the Reference Number and borrower Social Security Number entered on the online loan application do not match those provided by %a.,False
3075,"Verification of Income (VOI) Information on %a was received; however, the number of months of income reported on the VOI, or the Years/Months on Job entered in DU, does not meet the minimum of %a months required for DU to validate the borrower's income.",True
3077,"Employment has not been validated for the reasons provided. If income from this employment is being used to qualify the borrower, perform and document a verbal verification of employment no more than 10 business days (or 120 business day for self-employment) prior to the note date. If the borrower is in the military, obtain either a military Leave and Earnings Statement within 31 calendar days prior to the note date or a verification of employment through the Defense Manpower Data Center (https://www.dmdc.osd.mil.appj.mla/). Lenders also have the option of obtaining the verbal verification of employment after the note date (and prior to delivery of the loan to Fannie Mae), but when using this option must ensure compliance with the Selling Guide.
Borrower Name|Vendor|VOE Reference #|Employer Name|Reason(s)",True
3079,"Employment has been validated.  The report shown below is acceptable documentation to support this employment provided closing occurs on or before the earliest date.  
Borrower Name|Vendor|VOE Reference #|Employer Name|Close By Date",True
3089,"It appears the following open/active mortgages or HELOCs on the credit report are not disclosed on the loan application.  In order to ensure the minimum reserve requirement for other financed properties (not belonging to the principal residence or the subject property) is accurately calculated, all open/active mortgages must be entered on the loan application.  If any of the following mortgages have not been provided on the loan application, they must be provided and the loan casefile resubmitted to DU.
Borrower|Creditor|Account Number",True
3091,"This loan casefile has been underwritten using ARM plan 3252. This ARM plan is a uniform hybrid ARM for MBS and has specific pooling requirements. Refer to the Selling Guide for the specific requirements. If this is not the ARM plan that will be used to close and deliver the loan, update the ARM plan and resubmit the loan casefile to DU.",False
3093,"The following tradeline(s) were identified by DU as disputed by the borrower.  Because DU issued an Approve recommendation when including the disputed information in the credit risk assessment, no further action is necessary.
Creditor|Account Number|Account Type|Credit Repository",False
3095,"The subject transaction is a cash-out refinance and it appears the borrower is only paying off the subject property mortgage(s) and student loans.  If this loan qualifies as a Student Loan Cash-Out Refinance, the maximum amount of cash back to borrower at closing is the lesser of 2% or $2,000.  Additionally, the loan must be delivered with SFC 003 and SFC 841.  Refer to the Selling Guide for additional details.",True
3097,"Based on the Homebuyer Education Completion Indicator, at least one borrower on the loan has completed some type of homebuyer education.  At least one borrower signing the Note must have used one of these options: 1) complete the Framework homeownership education course prior to the closing of the mortgage loan, 2) receive housing counseling prior to signing the sales contract from a HUD-approved agency as defined in the Selling Guide and certified by completion of Fannie Mae Form 1017, or 3) meet the alternative option for borrowers who have already completed a homeownership education course required by a Community Seconds or Down Payment Assistance Program and provided by a HUD-approved agency. Refer to the Selling Guide for details and other information.",True
3099,"Based on the years and months on job or start date for %a's current employment, employment has not begun with %a.  If the lender will not obtain a paystub and confirm the borrower has started employment prior to delivery of the mortgage loan, the lender must confirm the loan meets the requirements to document income and employment using an employment offer/contract, confirm the loan meets the applicable reserve requirements, and the loan must be delivered with SFC 707.  Refer to the Selling Guide for additional information.",True
3121,"The number of financed properties used in determining the loan's eligibility for sale to Fannie Mae and minimum reserve requirements was 1.  This reflects just the subject property since there are no properties in the REO, and no mortgages listed on the loan application or credit report.  If this information is incorrect, provide the correct number in the Number of Financed Properties field, or complete the Real Estate Owned section of the loan application and resubmit the loan casefile to DU.",False
3123,"Based on the years and months or start date on job for %a's current employment, employment has not begun with %a.  Based on the loan purpose, number of units, or occupancy, the lender will need to obtain a paystub and confirm the borrower has started employment prior to delivery of the mortgage loan.  Refer to the Selling Guide for additional information.",True
3125,Verify that the borrower held legal title to the lot for at least six months prior to the closing date of this mortgage loan.,True
3127,"Based on the credit data received, a borrower has frozen their account with one of the credit repositories. No data from that repository was used in underwriting the loan casefile. The lender remains responsible for preventing fraud, which includes, but is not limited to, ensuring the borrower's identity has been verified.  In addition, the lender must continue to investigate any liabilities or derogatory credit that is disclosed by the borrower but not reflected on the credit report.",True
3129,"Based on the credit data received, a borrower has frozen their account with one of the credit repositories, and there is no data available from the other two repositories. DU has evaluated the loan casefile using the guidelines specific to borrowers without traditional credit. The lender remains responsible for preventing fraud, which includes, but is not limited to, ensuring the borrowers identity has been verified.  In addition, the lender must continue to investigate any liabilities or derogatory credit that is disclosed by the borrower.",True
3131,"This loan casefile is ineligible because the amount of the improvements listed in line B of the Details of Transaction exceeds the lesser of 50 percent of the as-completed appraised value or $50,000.",True
3133,"Based on the data entered, the amount of the improvements listed in line B of the Details of Transaction exceeds the lesser of 50 percent of the as-completed appraised value or $50,000.  Confirm that the amount of improvements do not exceed the lesser of 50 percent of the as-completed appraised value or $50,000, otherwise the loan casefile is ineligible for delivery.",True
3135,"Verify that the cost of improvements as entered in Line B of the Details of Transaction does not exceed the lesser of 50 percent of the as-completed appraised value or $50,000. If the cost of improvements exceeds the lesser of 50 percent of the as-completed appraised value or $50,000, the loan is not eligible for delivery to Fannie Mae.",True
3137,"The subject property was submitted as MH Advantage.  Verify that the property is legally classified as real property and that it meets the MH Advantage guidelines in addition to all manufactured home guidelines established in the Fannie Mae Selling Guide.  If this property is located in a PUD, condominium, or cooperative project, the project may be required to be submitted to Fannie Mae for review, with the exception of PUD projects consisting of double-width manufactured homes.  Refer to the Selling Guide for additional information.",True
3139,"Delinquency or default on Federal debt or other financial obligation was declared on declaration f in Section VIII of the loan application. If the delinquent debt is Federal income taxes that have not already been satisfied, they must be paid prior to or at closing and funds sufficient to settle the accounts must be verified. Refer to the Selling Guide to determine eligibility to include the payment due under a federal income tax installment agreement in the DTI instead of requiring payment in full.",True
