id,content,visible
2,The primary occupancy declaration for %a is inconsistent with the occupancy type of the property in Section II of the application.,True
7,This case does not meet Fannie Mae's eligibility requirements.,False
8,The risk profile of this loan casefile appears to meet Fannie Mae's guidelines.,False
9,This loan casefile appears to meet Fannie Mae's eligibility requirements.,False
10,"According to the Social Security Administration (SSA), the Social Security number (SSN) format for %a appears to be invalid. The SSN format may be invalid because it does not contain 9 numeric characters; or zeros were entered in the area number (first three digits of SSN), the group number (middle two digits), or the serial number (last four digits). The SSN must be reviewed for accuracy, the loan application updated to reflect a valid SSN for the borrower, and the loan casefile resubmitted to DU. If a valid SSN cannot be confirmed, the loan is not eligible for delivery to Fannie Mae.",True
11,"According to the Social Security Administration (SSA), the Social Security number (SSN) for %a either has not been issued, or was recently issued.   The SSN accuracy must be confirmed, and if incorrect, the SSN must be updated and the loan casefile resubmitted to DU.  If the SSN is determined to be correct, it must be validated directly with the SSA (direct validation by a third party is acceptable), and the loan must be delivered with SFC 162.  If the SSN cannot be validated with the SSA, the loan is not eligible for delivery to Fannie Mae.",True
12,"According to the Social Security Administration (SSA), based on the approximate issuance date of the Social Security number (SSN) and the borrower age on the application, the SSN entered for %a appears to have been issued prior to the borrower's date of birth.  The SSN accuracy must be confirmed, and if incorrect, it must be updated and the loan casefile resubmitted to DU.  If the SSN is determined to be correct, it must be validated directly with the SSA (direct validation by a third party is acceptable), and the loan must be delivered with SFC 162.  If the SSN cannot be validated with the SSA, the loan is not eligible for delivery to Fannie Mae.",True
27,The following data elements are invalid: Data element|Current value|,True
34,"The risk assessment of the loan casefile may not be accurate because the following accounts on the loan application did not have a minimum monthly payment and DU was unable to calculate an accurate debt-to-income ratio. The lender must ensure the DTI used in the risk assessment is accurate. If a payment must be included in the DTI, the payment amount must be entered on the loan application and the loan casefile resubmitted to DU. If the minimum monthly payment is $0, the lender must include documentation in the loan file confirming the $0 payment amount. Deferred installment debts must be included as part of the borrower's recurring monthly debt obligations. For student loans, the lender may qualify the borrower with the $0 payment if there is documentation to support that the $0 payment is associated with an income-driven repayment plan; alternatively, the lender must either use 1% of the outstanding balance as the estimated payment or derive a fully amortizing payment using the student loan documentation.
Borrower|Creditor|Account Number|Balance",True
36,"Based on the data submitted, it appears that cash is being received on a purchase or construction transaction.  This loan is eligible for delivery to Fannie Mae only if the cash back to the borrower is reimbursement for earnest money paid by the borrower prior to closing, for the borrower's overpayment of fees and charges (including excess lender credit derived from premium pricing), and/or for a pro-rated real estate tax credit (in locales where real estate taxes are paid in arrears).  If the borrower receives cash back for a permissible purpose as listed above, the lender must confirm that the minimum borrower contribution requirements, if any, have been met.",True
37,"This case is out of scope.  Desktop Underwriter does not contain the rules or models that are necessary in order to underwrite the product, borrower, or type of loan submitted.  Underwriting results may therefore not be valid.",True
45,Verify that the borrower held legal title to the lot prior to the first advance of interim construction financing.,True
59,"The following assets were counted towards available funds.  With the exception of cash on hand, all available funds greater than the amount required to close have been added to cash reserves.
Borrower|Asset Type|Institution Name|Amount",True
63,Verify assets totaling $%a from the liquid assets listed on the 1003.  Refer to the Selling Guide for additional information.,True
64,"If depository assets are needed to support the amount of funds required for reserves, verify these assets with a verification of deposit or bank statements covering a one-month period. Direct verifications provided by a third party asset verification vendor are acceptable if completed in accordance with the Selling Guide.",True
70,"Unsecured borrowed funds have been listed as a source of down payment. The only unsecured borrowed funds permitted are loans from an employer-assisted housing program. If the unsecured borrowed funds are not in the form of a loan from an employer-assisted housing program, the loan is ineligible.",True
71,This case is ineligible because sweat equity is listed as a source of funds for closing.  This is only an eligible source of funds for the down payment and/or closing costs for Community Lending loans.,True
72,"Trade equity is listed as a source of funds for closing.  The property seller may take a borrower's existing property in trade as part of the down payment, as long as the borrower has made the minimum required cash down payment and his or her equity contribution is a true-value consideration.  An appraisal for the property that is being taken in trade is required.",True
73,This case is ineligible because cash-on-hand is listed as a source of funds for closing.  This is an ineligible source of funds for the down payment and for closing costs.,True
79,"The market value of an automobile or other asset has not been included in the amount of available funds.  If the funds from this asset are needed to support the closing costs and/or reserves requirement, document the value and ownership of the asset and verify the receipt of the funds prior to closing.  Include the amount of the asset in another liquid asset account.",True
81,"A trust fund was included in available funds.  For loan casefiles that are not underwritten as DU Refi Plus, the loan file must contain verification documents according to the Fannie Mae Selling Guide.  For DU Refi Plus loan casefiles, the trust fund must be verified with one recent statement showing the asset balance.",True
83,A retirement account is listed as a source of funds and no corresponding asset could be found. Enter the value of this asset discounted as required per the Selling Guide if the funds will be used for reserves.,True
84,"The value entered for the retirement account must be determined in accordance with the Selling Guide if the funds will be used for reserves. If these assets are needed to support the amount of funds required for closing and reserves, the available account balance must be documented with a recent depository or brokerage account statement. For loan casefiles that are not underwritten as DU Refi Plus, if the funds will be used for down payment or closing costs, receipt of the funds realized from the sale or liquidation of the assets is not required if the value (as determined in accordance with the Selling Guide) is at least 20% more than the amount of funds needed for the down payment and closing costs. Otherwise, receipt of funds realized from the sale or liquidation must be verified. Also for loan casefiles that are not underwritten as DU Refi Plus, if the account allows for withdrawals only in connection with the borrower's employment termination, retirement, or death; or the account does not allow for any type of withdrawal, the retirement asset should not be entered.",True
88,"A secured loan is included in available funds. Documents that verify the terms of the loan and the fact that it is secured must be included in the loan file. Monthly payments for the loan must be considered in the debt-to-income ratio unless the loan is secured by a financial asset. If the loan is secured by a financial asset, the asset must be reduced by the amount of the loan.",True
90,"Rental payments that exceed the market rent are listed as a source of funds for closing. Enter a corresponding Other Credit in the Details of Transaction. Obtain a copy of the rental/purchase agreement, canceled checks or money order receipts to document the rental payment for the last 12 months, and evidence of market rent must be provided by the appraiser.",True
91,"When fully vested stock or bond account(s) are needed to support the amount of funds required for reserves, the value entered may be 100 percent of the value of the account. Document the value with a current brokerage account statement or a copy of the stock certificate accompanied by a dated newspaper stock list. When fully vested stock and bond accounts are used for the down payment or closing costs, if the value is at least 20% more than the amount of funds needed, documentation of the borrower's receipt of funds from the sale or liquidation of those assets is not required. Otherwise, document the borrower's receipt of funds from the sale of those assets. Non-vested stock options and non-vested restricted stock are not acceptable sources of funds for the down payment, closing costs, or reserves.",True
92,"Stocks or bonds are listed as a source of funds for closing and there is no corresponding asset.  The value of fully vested stocks and bonds may be entered as 100 percent of the estimated liquidation value (or redemption value) of the account if the funds will be used as reserves. ",True
93,Lease purchase funds for rent credits were entered as an Other Credit and were included in available funds.  The loan file must contain verification documents according to the Fannie Mae Selling Guide.,True
95,"A bridge loan was included in available funds.  Provide copies of the bridge loan documents in the loan file.  The bridge loan must be listed in the liabilities section of the 1003, and a monthly payment must be included in the debt-to-income ratio.  Refer to the Selling Guide for additional information.",True
96,"A bridge loan is listed as a source of funds for closing and there is no corresponding asset.  Provide copies of the bridge loan documents in the loan file.  The bridge loan must be listed in the liabilities section of the 1003, and a monthly payment must be included in the debt-to-income ratio.  Refer to the Selling Guide for additional information.",True
99,"All net equity funds should be verified with a photocopy of the settlement statement. If the net equity is negative, the amount will be subtracted from the borrower's available funds.",True
101,The Real Estate section of the application lists real estate that has been sold. Document the sale of the property by providing a copy of the settlement statement. The net equity from the sale of the property should be included in a liquid asset account.,True
106,A checking or savings account is listed as a source of funds for closing and there is no corresponding asset.  To verify this asset use the most recent bank statements covering a %a month period.,True
107,"Funds in the amount of $%a are required for closing.  Available funds are insufficient by $%a.   Assets sufficient to close the loan must be from eligible sources, and must be qualified and verified.",True
108,"Liabilities that have been marked ""paid by close"" in the application have not been added to required funds. For cash-out refinance transactions, all debts to be paid off using proceeds from the transaction must be included in Section VII, Details of Transaction - line D. Verify and document the funds needed to pay off accounts marked ""paid by close.""",True
109,"The balance of each of the following liabilities to be paid by closing has been added to required funds.
Borrower|Creditor|Account Number|Balance",True
119,"Desktop Underwriter does not include cash back received from the transaction in the borrower's cash reserves calculation.  Therefore, the amount of cash back, $%a, has not been included in cash reserves.",False
128,The taxes and insurance payment from the retained REO has been added to the total expense payment used in the debt-to-income ratio.,False
140,Desktop Underwriter was unable to calculate the housing and debt-to-income ratios because qualified income is 0.,True
152,"%a's self-employed income must be supported by personal tax returns covering the most recent year, with all schedules.",True
153,"The following sources of income were used in the underwriting analysis:
Borrower|Income Type|Amount",False
162,"Document %a's income using a paystub and a W-2 from the prior year, or using a standard Verification of Employment (1005).  The paystub must be dated no earlier than 30 days prior to the initial loan application date, include all year-to-date earnings, and include sufficient information to appropriately calculate income.  Otherwise, additional documentation must be obtained.  If a W-2 is not available from the prior year, the lender must determine if the income would still be acceptable per the Selling Guide.  If a standard Verification of Employment (1005) will be obtained it must include all year-to-date earnings as well as prior year earnings if a W-2 is not being provided.  Direct verifications provided by a third party employment verification vendor are acceptable if completed in accordance with the Selling Guide.",True
164,%a's income must be supported by one paystub or by a standard Verification of Employment (1005). The paystub must be dated no earlier than 30 days prior to the initial loan application date and it must include all year-to-date earnings. Commission income may be supported by one paystub or federal tax returns covering the most recent year. Direct verifications provided by a third party employment verification vendor are acceptable if completed in accordance with the Selling Guide.,True
166,Verify other income for %a in accordance with the Selling Guide.,True
169,%a's military income must be supported by either a Leave and Earnings Statement or by a Standard Verification of Employment (1005). Verify that this income was not also included in base income.,True
171,"Foster care income for %a was used in the underwriting analysis. Document the income in accordance with the Fannie Mae Selling Guide.  The borrower must have a minimum twelve-month history of providing foster care services under a recognized program. If the income has been received for less than 24 months, it cannot represent more than 30% of the total gross income used to qualify the borrower.",True
174,Income from automobile allowances is determined using the income and debt approach (add full amount of allowance to income and full amount of automobile lease or financing payment to liabilities). The borrower must have been receiving the income for at least two years.,True
176,"Verify the net rental income or loss from any properties (that are not the subject property) with either the borrower's most recent federal income tax return (Pages 1, 2 and Schedule E), or a copy of the current lease agreement. Additionally rental income is not permitted on second homes. No documentation is required for qualifying purposes if the debt-to-income ratio already includes the entire rental property payment (i.e., income from the property is not considered). Refer to the Selling Guide for additional information on rental history, documentation requirements, and the calculation and treatment of rental income.",True
177,"Unemployment and/or public assistance benefits for %a were used from the application.  Unemployment compensation cannot be used to qualify the borrower unless it is clearly associated with seasonal employment that is reported on the borrower's federal income tax returns and verification that the seasonal income is likely to continue.  Unemployment income must be verified with copies of the borrower's tax returns for the past two years.  Public assistance benefits must be verified with letters or exhibits from the paying agency that evidence the amount, frequency, and duration of the benefit.",True
179,"VA benefit income for %a must be verified with a VA letter or distribution form.  If this income is not from retirement or long term disability, it cannot be used for qualifying unless it will continue for at least three years (not applicable to DU Refi Plus loan casefiles).  Education benefits may not be used for qualifying purposes.",True
181,"The amount, frequency, and duration of the trust income for %a must be verified by the Trust Agreement or by the trustee's statement confirming the amount, frequency, and duration of payments.  This income cannot be used for qualifying unless it will continue for at least three years.",True
183,The amount and duration of mortgage differential income for %a must be verified in writing by the borrower's employer.  The income cannot be used for qualifying unless it will continue for at least three years.,True
185,"Interest and dividend income for %a must be verified by 2 years tax returns and all supporting schedules, or account statements. It must have been received for the past two years and the asset generating the income must be verified. Any funds used for the down payment or closing costs must be subtracted before the interest and dividends are calculated.  Documentation of asset ownership must be in compliance with the Age of Documents Policy per the Selling Guide.",True
187,Income from notes receivable for %a must be verified with (1) a copy of the note and (2) evidence of these funds.  Verify that the income has been received for the most recent 12 months and will continue for at least three years.,True
189,"Alimony or child support must be verified with one of the following documents: divorce decree, separation agreement, court decree, any other legal agreement that describes the payment terms, or any applicable state law that requires such payments and specifies the conditions under which the payments must be made.  For loan casefiles that are not underwritten as DU Refi Plus, the borrower must have a minimum 6-month documented history of the borrower's most recent regular and timely receipt of the full payment, and the lender must verify the income will continue for at least three years.  Refer to the Fannie Mae Selling Guide for additional information.",True
191,"If the Social Security income for %a is classified as retirement or disability income from the borrower's own Social Security Account, obtain either proof of current receipt, or the Social Security Administration's (SSA) award letter.  If the Social Security income is for Survivor Benefits, retirement, or disability for the benefit of another, verify  the income with all of the  following documents:  a copy of the SSA award letter, proof of current receipt, and any additional documentation required to confirm a three-year continuance.  Supplemental Security Income must be verified with a copy of the SSA award letter and proof of current receipt.  Refer to the Selling Guide for additional information.",True
193,"Document regular and continued receipt of retirement, government annuity, or pension income for %a with one of the following documents:  letters from the organization providing the income, retirement award letters, federal tax returns, IRS W-2 or 1099 forms, or bank statement. Documentation of three-year continuance is not required. For loan casefiles that are not underwritten as DU Refi Plus, if retirement income is paid in the form of a monthly distribution from a 401(k), IRA, SEP or Keogh retirement account, document three year continuance of income from the date of the mortgage application.  Documentation of asset ownership must be in compliance with the Allowable Age of Documents policy.",True
225,"Include evidence of payoff of the following debts (other than 30 day accounts) in the loan file:
Borrower|Creditor|Account Number|Balance",True
230,"Alimony, child support, or separate maintenance for %a has been listed as a liability on the application but the payment was not included in the debt-to-income ratio because the Months Left to Pay is ten months or less. Confirm the number of months remaining using the divorce decree, separation agreement, or any other written legal agreement.  If the payment will continue for more than ten months, update the information in the online loan application and resubmit the loan casefile to DU.",True
237,"According to the credit report, the total payments and balances declared on the 1003 differ by more than expected tolerances. Verify that all liabilities belonging to the borrowers are disclosed on the 1003 and that the balances and payments are accurate.",True
248,"The following accounts listed on the loan application were omitted from the underwriting calculations.  For each liability that belongs to the borrower, provide documentation that supports the omission.  If any of these accounts will be paid prior to or at closing, those accounts must be marked paid by closing (not omitted) and the loan casefile must be resubmitted to DU.
Borrower|Creditor|Account Number|Balance",True
252,"Desktop Underwriter has calculated minimum monthly payments, which are used in the debt-to-income ratio, for the following accounts. If the account(s) should not be included in the debt-to-income ratio, omit the liabilities on the loan application and document the reason for the omission.
Borrower|Creditor|Payment|Balance",True
253,"Undisclosed debt has been identified on the credit report.  These debts have not been included in the CLTV or the qualifying debt-to-income ratio.  For each undisclosed debt, provide documentation or explanation that confirms that it should not be included on the 1003 or include the debt on the 1003 and resubmit the case for underwriting. 
Borrower|Creditor|Payment|Balance",True
258,"The past-due amount of the following accounts must be satisfied prior to or at closing, and funds sufficient to settle these items must be verified and documented. If any of these accounts are actually a collection or charge-off, the lender may follow the DU collection and charge-off policy specified in the Selling Guide.
Borrower|Creditor|Account Number|Amount",True
260,"If the following collection and chargeoff accounts have not been satisfied, all accounts with a balance of $250 or more must be paid in full prior to or at closing.  If the aggregate of all accounts is greater than $1,000, all accounts must be paid in full prior to or at closing.  Funds sufficient to settle the account(s) must be verified and documented.  Refer to the Fannie Mae Selling Guide for additional information.
Borrower|Creditor|Account Number|Amount",True
268,A lawsuit was indicated on Section VIII of the loan application. Determine if the lawsuit will have any impact on the borrower's ability to repay the loan.,True
271,A judgment declared on Section VIII of the loan application was not found on the credit report. Outstanding judgments must be paid in full prior to or at closing and funds sufficient to settle these items must be verified and documented.,True
272,"Alimony, child support, or separate maintenance was declared on Section VIII of the loan application, but a corresponding liability was not listed on Section VIL of the loan application. Payments of a continuing nature must be included as a liability on the loan application.  Enter this information and resubmit the loan casefile for underwriting.   For alimony liabilities, the lender has the option of either entering the alimony as a liability, or reducing total qualifying income by the amount of the alimony payment.",True
273,"The use of borrowed funds for the down payment was declared on Section VIII of the loan application, and there is no corresponding asset listed for that borrower. The terms of the loan and the fact that it is secured must be verified. Monthly payments for the loan must be considered as debt for qualifying the borrower.",True
274,Endorsement of a note was declared on Section VIII of the loan application.  The contingent liability does not need to be considered as part of the borrower's monthly debt obligations if the lender can verify a history of documented payments on the debt by the primary obligor and ascertain that there is not a history of delinquent payments for that debt.,True
275,"Evidence of the existence of a typhoon endorsement must be included in the loan file.  In addition, if the construction type of the subject property is masonry construction, evidence of the existence of earthquake insurance must also be included in the loan file.",True
276,Evidence of the existence of earthquake insurance must be included in the loan file.,True
277,Verify that the terms of the leasehold estate comply with the requirements of the Fannie Mae Selling Guide.  The property must be in an area where the use of leasehold estates have received market acceptance.,True
278,"This loan is subject to all lender specified conditions and must comply with all applicable federal, state, and local laws and regulations.",False
280,"If the buydown is funded by an interested party to the transaction, then the amount of the buydown must be added to total contributions and subject to Fannie Mae's contribution limits.",True
